{
  "schema_version": 1,
  "registry_id": "android17-compatibility-20260927-ims-v1",
  "target": {
    "android_release": "17",
    "api_level": 37,
    "architecture": "arm64-v8a",
    "required_build_type": "user",
    "suite_release": "17_r2",
    "candidate_environment_id": "fp6-android17-grapheneos-2026091000-debian13-v13-ims-iwlan",
    "candidate_status": "pending-fp6-user-build"
  },
  "minimum_host": {
    "architecture": "x86_64",
    "memory_gib": 32,
    "free_disk_gib": 256,
    "glibc_minimum": "2.17",
    "locale": "English",
    "dependencies": [
      "FFmpeg 5.1.3 or newer",
      "current Android platform-tools adb",
      "current Android build-tools aapt and aapt2"
    ]
  },
  "device_preparation": [
    "Use a user build matching the exact suite release and architecture.",
    "Remove screen credentials and enable USB debugging and Stay awake.",
    "Use 12-hour time, automatic date/time and automatic time zone.",
    "Enable location, IPv4/IPv6 isolated-client Wi-Fi and Allow Mock Modem where required.",
    "Install the exact architecture/version APEX shim and CTS media required by selected modules.",
    "Insert an empty supported microSD and an activated SIM in each applicable slot; CTS may erase removable media.",
    "Record every manual setting and fixture in the private setup record; production code must not detect CTS."
  ],
  "teardown": [
    "Export and hash the complete result tree before cleanup.",
    "Remove CTS-only packages, media and settings or wipe the disposable harness candidate.",
    "Restore the rig role and scheduled battery policy only after the persistent inhibitor is released.",
    "Keep identifiers, SIM/account data and raw logs in private evidence storage."
  ],
  "official_sources": [
    {
      "id": "cts-downloads",
      "url": "https://source.android.com/docs/compatibility/cts/downloads",
      "checked_at": "2026-09-20",
      "purpose": "Android 17 R2 CTS and CTS Verifier package selection"
    },
    {
      "id": "cts-setup",
      "url": "https://source.android.com/docs/compatibility/cts/setup",
      "checked_at": "2026-09-20",
      "purpose": "host, DUT, APEX shim and media preparation"
    },
    {
      "id": "cts-verifier",
      "url": "https://source.android.com/docs/compatibility/cts/verifier",
      "checked_at": "2026-09-20",
      "purpose": "manual execution and supported report export"
    },
    {
      "id": "vts-systems",
      "url": "https://source.android.com/docs/core/tests/vts/systems",
      "checked_at": "2026-09-20",
      "purpose": "source-built VTS package and plan names"
    },
    {
      "id": "vts-debug-ramdisk",
      "url": "https://source.android.com/docs/core/tests/vts/vts-on-gsi",
      "checked_at": "2026-09-20",
      "purpose": "debug companion and evidence limitation"
    }
  ],
  "packages": [
    {
      "id": "cts-17-r2-arm",
      "kind": "cts",
      "delivery": "official-download",
      "version": "17_r2",
      "url": "https://dl.google.com/dl/android/cts/android-cts-17_r2-linux_x86-arm.zip",
      "archive_name": "android-cts-17_r2-linux_x86-arm.zip",
      "archive_sha256": "2d7195cbcee830f7c15d306c36ccdfe4d568f5d819c8a62aa25f1390a1092fe0",
      "acquisition_status": "verified",
      "extracted_directory": "android-cts",
      "launcher": "tools/cts-tradefed",
      "plan": "cts"
    },
    {
      "id": "cts-verifier-17-r2-arm",
      "kind": "cts-verifier",
      "delivery": "official-download",
      "version": "17_r2",
      "url": "https://dl.google.com/dl/android/cts/android-cts-verifier-17_r2-linux_x86-arm.zip",
      "archive_name": "android-cts-verifier-17_r2-linux_x86-arm.zip",
      "archive_sha256": "83bd5a023f175b46ce1077da918a2eecb5ec5d7bad70f1410f12be88a8167dad",
      "acquisition_status": "verified",
      "extracted_directory": "android-cts-verifier",
      "launcher": null,
      "plan": "manual-export"
    },
    {
      "id": "vts-17-source",
      "kind": "vts",
      "delivery": "pinned-source-build",
      "version": "17_r1",
      "url": "https://android.googlesource.com/platform/test/vts/",
      "archive_name": "android-vts.zip",
      "archive_sha256": "62676bea6a9c26ad1a4db6467971c480979940fd2957d3ba32eb52c5a3a51407",
      "acquisition_status": "verified",
      "extracted_directory": "android-vts",
      "launcher": "tools/vts-tradefed",
      "plan": "vts",
      "source_build": {
        "environment_id": "android17-vts-arm64-2026091000-debian13-v3-execveat",
        "project_map_sha256": "d4721af78c2adb15d934afdf2aa3309fd21788ba785d5e8064a25fcfc4d1f70d",
        "recipe_sha256": "5f17e7a3f12e322db3a073de8ae3dbaf09cec48fc8dce378927a5f0b5d721c90",
        "evidence_sha256": "26e1f14ddcd98845dda8874abdacaad0e8e8831c27704ca48ff20514dc2268d4",
        "source_changes": [
          {
            "project": "external/ltp",
            "base_revision": "3fe7435d5b984b46d1d1528cc9850a48d888d8c8",
            "derived_revision": "69a4a31500a61f23d7f43d56c3fd290cc47ad41e",
            "patch_sha256": "251237d1bef7cac670d59ae6ecf1bba6afecdc9c01248cff49a22cdec297915e"
          }
        ]
      }
    },
    {
      "id": "cts-16-r6-arm",
      "kind": "cts",
      "delivery": "official-download",
      "version": "16_r6",
      "url": "https://dl.google.com/dl/android/cts/android-cts-16_r6-linux_x86-arm.zip",
      "archive_name": "android-cts-16_r6-linux_x86-arm.zip",
      "archive_sha256": "44deb3366de5771762c7d16f211d0d8679caab5d2ef55e09048dce91c16db6fb",
      "acquisition_status": "verified",
      "extracted_directory": "android-cts",
      "launcher": "tools/cts-tradefed",
      "plan": "cts"
    },
    {
      "id": "cts-verifier-16-r6-arm",
      "kind": "cts-verifier",
      "delivery": "official-download",
      "version": "16_r6",
      "url": "https://dl.google.com/dl/android/cts/android-cts-verifier-16_r6-linux_x86-arm.zip",
      "archive_name": "android-cts-verifier-16_r6-linux_x86-arm.zip",
      "archive_sha256": "0ab2f98734427cf392dc6fc574ba30003737d981b42db3ae2525b975543e3bb5",
      "acquisition_status": "verified",
      "extracted_directory": "android-cts-verifier",
      "launcher": null,
      "plan": "manual-export"
    }
  ],
  "trial_profiles": [
    {
      "id": "android17-final-user",
      "android_release": "17",
      "build_type": "user",
      "package_id": "cts-17-r2-arm",
      "module": null,
      "test": null,
      "required_fixture_ids": [
        "camera-light-scene",
        "display-touch-audio",
        "telephony-peer-provider-variance",
        "microsd-usb-hub",
        "biometric-human-presence",
        "ble-beacons-three",
        "gnss-signal",
        "ipv4-ipv6-isolated-wifi",
        "dual-wifi-and-rtt",
        "cts-verifier-peer",
        "distance-fixtures",
        "router-offline-control",
        "cts-media-1.5"
      ],
      "status": "blocked-pending-candidate-and-package"
    },
    {
      "id": "stock16-harness-trial",
      "android_release": "16",
      "build_type": "user",
      "package_id": "cts-16-r6-arm",
      "module": "CtsOsTestCases",
      "test": "android.os.cts.SystemClockTest#testUptimeMillis",
      "required_fixture_ids": [],
      "status": "ready-labelled-stock-harness-trial"
    }
  ],
  "fixtures": [
    {
      "id": "camera-light-scene",
      "status": "available",
      "handling": "manual fixed scene and controlled USB light"
    },
    {
      "id": "display-touch-audio",
      "status": "available",
      "handling": "manual operator observation"
    },
    {
      "id": "telephony-peer-provider-variance",
      "status": "available",
      "handling": "dedicated peer handset and test subscriptions"
    },
    {
      "id": "microsd-usb-hub",
      "status": "available",
      "handling": "dedicated removable media and qualified powered USB rig"
    },
    {
      "id": "biometric-human-presence",
      "status": "manual",
      "handling": "operator-attended enrollment and observation only"
    },
    {
      "id": "ble-beacons-three",
      "status": "missing",
      "handling": "CTS requires at least three BLE beacons within five metres when Bluetooth LE is supported"
    },
    {
      "id": "gnss-signal",
      "status": "unverified",
      "handling": "verify a usable GNSS signal and required SUPL reachability at the execution site"
    },
    {
      "id": "ipv4-ipv6-isolated-wifi",
      "status": "unverified",
      "handling": "qualify IPv4, IPv6, DNS, multicast and isolated-client behavior"
    },
    {
      "id": "dual-wifi-and-rtt",
      "status": "unverified",
      "handling": "required conditionally for reported STA concurrency or Wi-Fi RTT support"
    },
    {
      "id": "cts-verifier-peer",
      "status": "unverified",
      "handling": "qualify a second Android device for Bluetooth, Wi-Fi Direct, Wi-Fi Aware and NFC HCE; UWB only if reported"
    },
    {
      "id": "distance-fixtures",
      "status": "missing",
      "handling": "stage holders and measured distances for applicable proximity calibration"
    },
    {
      "id": "router-offline-control",
      "status": "unverified",
      "handling": "qualify a router whose internet path can be disconnected without powering it off"
    },
    {
      "id": "cts-media-1.5",
      "status": "missing",
      "handling": "stage exact official media package before media cases"
    },
    {
      "id": "nfc-protocol-fixtures",
      "status": "unverified",
      "handling": "inventory exact CTS Verifier cases before purchase or assignment"
    },
    {
      "id": "usb-audio-loopback",
      "status": "unverified",
      "handling": "inventory exact CTS Verifier cases before purchase or assignment"
    },
    {
      "id": "secure-element-cardlet",
      "status": "conditional",
      "handling": "required only if DUT reports the official multi-secure-element condition"
    }
  ],
  "applicability": [
    {
      "id": "cts",
      "decision": "required-final-user",